2@cselab2pc78:~$ mysql -u idbms2 -p
Enter password: 
Welcome to the MySQL monitor.  Commands end with ; or \g.
Your MySQL connection id is 8
Server version: 8.0.31-0ubuntu0.20.04.1 (Ubuntu)

Copyright (c) 2000, 2022, Oracle and/or its affiliates.

Oracle is a registered trademark of Oracle Corporation and/or its
affiliates. Other names may be trademarks of their respective
owners.

Type 'help;' or '\h' for help. Type '\c' to clear the current input statement.

mysql> create database social_rollno;
Query OK, 1 row affected (0.14 sec)

mysql> use social_rollno;
Database changed
mysql> source /home/b2/Desktop/social1.sql;
Query OK, 0 rows affected, 1 warning (0.03 sec)

Query OK, 0 rows affected, 1 warning (0.03 sec)

Query OK, 0 rows affected, 1 warning (0.02 sec)

Query OK, 0 rows affected, 1 warning (0.04 sec)

Query OK, 0 rows affected (0.47 sec)

Query OK, 0 rows affected (0.59 sec)

Query OK, 0 rows affected (1.12 sec)

Query OK, 0 rows affected (0.62 sec)

Query OK, 0 rows affected (0.50 sec)

Query OK, 0 rows affected (0.46 sec)

Query OK, 1 row affected (0.09 sec)

Query OK, 1 row affected (0.09 sec)

Query OK, 1 row affected (0.08 sec)

Query OK, 1 row affected (0.10 sec)

Query OK, 1 row affected (0.13 sec)

Query OK, 1 row affected (0.10 sec)

Query OK, 1 row affected (0.10 sec)

Query OK, 1 row affected (0.10 sec)

Query OK, 1 row affected (0.09 sec)

Query OK, 1 row affected (0.08 sec)

Query OK, 1 row affected (0.07 sec)

Query OK, 1 row affected (0.09 sec)

Query OK, 1 row affected (0.08 sec)

Query OK, 1 row affected (0.06 sec)

Query OK, 1 row affected (0.09 sec)

Query OK, 1 row affected (0.06 sec)

Query OK, 1 row affected (0.07 sec)

Query OK, 1 row affected (0.10 sec)

Query OK, 1 row affected (0.10 sec)

Query OK, 1 row affected (0.10 sec)

Query OK, 1 row affected (0.10 sec)

Query OK, 1 row affected (0.10 sec)

Query OK, 1 row affected (0.10 sec)

Query OK, 1 row affected (0.10 sec)

Query OK, 1 row affected (0.08 sec)

Query OK, 1 row affected (0.07 sec)

Query OK, 1 row affected (0.07 sec)

Query OK, 1 row affected (0.06 sec)

Query OK, 1 row affected (0.08 sec)

Query OK, 1 row affected (0.09 sec)

Query OK, 1 row affected (0.07 sec)

Query OK, 1 row affected (0.05 sec)

Query OK, 1 row affected (0.09 sec)

Query OK, 1 row affected (0.10 sec)

Query OK, 1 row affected (0.07 sec)

Query OK, 1 row affected (0.08 sec)

Query OK, 1 row affected (0.07 sec)

Query OK, 1 row affected (0.08 sec)

Query OK, 1 row affected (0.08 sec)

Query OK, 1 row affected (0.07 sec)

Query OK, 1 row affected (0.07 sec)

Query OK, 1 row affected (0.08 sec)

Query OK, 1 row affected (0.08 sec)

Query OK, 1 row affected (0.08 sec)

Query OK, 1 row affected (0.10 sec)

Query OK, 1 row affected (0.10 sec)

Query OK, 1 row affected (0.12 sec)

Query OK, 1 row affected (0.37 sec)

Query OK, 1 row affected (0.07 sec)

Query OK, 1 row affected (0.10 sec)

Query OK, 1 row affected (0.10 sec)

Query OK, 1 row affected (0.06 sec)

Query OK, 1 row affected (0.08 sec)

Query OK, 1 row affected (0.08 sec)

Query OK, 1 row affected (0.10 sec)

Query OK, 1 row affected (0.10 sec)

Query OK, 1 row affected (0.10 sec)

Query OK, 1 row affected (0.11 sec)

Query OK, 1 row affected (0.08 sec)

Query OK, 1 row affected (0.09 sec)

Query OK, 1 row affected (0.05 sec)

Query OK, 1 row affected (0.05 sec)

Query OK, 1 row affected (0.08 sec)

Query OK, 1 row affected (0.06 sec)

Query OK, 1 row affected (0.06 sec)

Query OK, 1 row affected (0.08 sec)

Query OK, 1 row affected (0.07 sec)

Query OK, 1 row affected (0.08 sec)

Query OK, 1 row affected (0.08 sec)

Query OK, 1 row affected (0.10 sec)

Query OK, 1 row affected (0.13 sec)

Query OK, 1 row affected (0.09 sec)

Query OK, 1 row affected (0.07 sec)

Query OK, 1 row affected (0.10 sec)

Query OK, 1 row affected (0.07 sec)

Query OK, 1 row affected (0.12 sec)

Query OK, 1 row affected (0.07 sec)

Query OK, 1 row affected (0.08 sec)

Query OK, 1 row affected (0.09 sec)

Query OK, 1 row affected (0.07 sec)

Query OK, 1 row affected (0.14 sec)

Query OK, 1 row affected (0.06 sec)

Query OK, 1 row affected (0.06 sec)

Query OK, 1 row affected (0.08 sec)

Query OK, 1 row affected (0.10 sec)

Query OK, 1 row affected (0.10 sec)

Query OK, 1 row affected (0.10 sec)

Query OK, 1 row affected (0.10 sec)

Query OK, 1 row affected (0.10 sec)

Query OK, 1 row affected (0.10 sec)

Query OK, 1 row affected (0.18 sec)

Query OK, 1 row affected (0.09 sec)



mysql> create trigger insertsym
    -> after insert on Friend
    -> for each row
    -> begin
    -> insert into Friend_1 values(new.ID2,new.ID1);
    -> end$
Query OK, 0 rows affected (0.10 sec)

mysql> create trigger deletesym
    -> after delete on Friend
    -> for each row
    -> begin 
    -> delete from Friend_1 where ID1=old.ID2 and ID2=old.ID1;
    -> END$
Query OK, 0 rows affected (0.09 sec)

mysql> insert into Friend_1 values(new.ID2,new.ID1);
    -> 

^C
mysql> insert into Friend values(100,200)$
Query OK, 1 row affected (0.08 sec)


mysql> SELECT * from Friend$
+------+------+
| ID1  | ID2  |
+------+------+
| 1510 | 1381 |
| 1510 | 1689 |
| 1689 | 1709 |
| 1381 | 1247 |
| 1709 | 1247 |
| 1689 | 1782 |
| 1782 | 1468 |
| 1782 | 1316 |
| 1782 | 1304 |
| 1468 | 1101 |
| 1468 | 1641 |
| 1101 | 1641 |
| 1247 | 1911 |
| 1247 | 1501 |
| 1911 | 1501 |
| 1501 | 1934 |
| 1304 | 1934 |
| 1934 | 1304 |
| 1304 | 1661 |
| 1661 | 1025 |
|  100 |  200 |
+------+------+
21 rows in set (0.00 sec)

mysql> SELECT * from Friend_1$
+------+------+
| ID1  | ID2  |
+------+------+
| 1510 | 1381 |
| 1510 | 1689 |
| 1689 | 1709 |
| 1381 | 1247 |
| 1709 | 1247 |
| 1689 | 1782 |
| 1782 | 1468 |
| 1782 | 1316 |
| 1782 | 1304 |
| 1468 | 1101 |
| 1468 | 1641 |
| 1101 | 1641 |
| 1247 | 1911 |
| 1247 | 1501 |
| 1911 | 1501 |
| 1501 | 1934 |
| 1304 | 1934 |
| 1934 | 1304 |
| 1304 | 1661 |
| 1661 | 1025 |
|  200 |  100 |
+------+------+
21 rows in set (0.01 sec)

mysql> delete from Friend where ID1=1304 and ID2=1934$
Query OK, 1 row affected (0.11 sec)

mysql> SELECT * from Friend_1$
+------+------+
| ID1  | ID2  |
+------+------+
| 1510 | 1381 |
| 1510 | 1689 |
| 1689 | 1709 |
| 1381 | 1247 |
| 1709 | 1247 |
| 1689 | 1782 |
| 1782 | 1468 |
| 1782 | 1316 |
| 1782 | 1304 |
| 1468 | 1101 |
| 1468 | 1641 |
| 1101 | 1641 |
| 1247 | 1911 |
| 1247 | 1501 |
| 1911 | 1501 |
| 1501 | 1934 |
| 1304 | 1934 |
| 1304 | 1661 |
| 1661 | 1025 |
|  200 |  100 |
+------+------+
20 rows in set (0.00 sec)

mysql> SELECT * from Friend$
+------+------+
| ID1  | ID2  |
+------+------+
| 1510 | 1381 |
| 1510 | 1689 |
| 1689 | 1709 |
| 1381 | 1247 |
| 1709 | 1247 |
| 1689 | 1782 |
| 1782 | 1468 |
| 1782 | 1316 |
| 1782 | 1304 |
| 1468 | 1101 |
| 1468 | 1641 |
| 1101 | 1641 |
| 1247 | 1911 |
| 1247 | 1501 |
| 1911 | 1501 |
| 1501 | 1934 |
| 1934 | 1304 |
| 1304 | 1661 |
| 1661 | 1025 |
|  100 |  200 |
+------+------+
20 rows in set (0.00 sec)

mysql> create trigger grade 
    -> after insert on Highschooler
    -> for each row
    -> begin
    -> if new.grade<9 or new.grade>12 then
    -> insert into Highschooler_1 values(new.ID,new.name,'NULL') 
    -> elseif new.grade=NULL
    -> THEN insert into Highschooler_1 values(new.id,new.name,9);
    -> end if;
    -> end$
ERROR 1064 (42000): You have an error in your SQL syntax; check the manual that corresponds to your MySQL server version for the right syntax to use near 'elseif new.grade=NULL
THEN insert into Highschooler_1 values(new.id,new.name,9);' at line 7
mysql> create trigger grade  after insert on Highschooler for each row begin if new.grade<9 or new.grade>12 then insert into Highschooler_1 values(new.ID,new.name,'NULL');  elseif new.grade=NULL THEN insert into Highschooler_1 values(new.id,new.name,9); end if; end$
Query OK, 0 rows affected (0.09 sec)

mysql> create trigger graduate
    -> after update on Highschooler
    -> for each row
    -> begin 
    -> if new.grade>12
    -> then delete from Highschooler_1 where ID=new.ID;
    -> elseif new.grade = old.grade+1 then
    -> update Highschooler_1 set grade=grade + 1 where ID in (select ID2 from Friend where ID1=new.ID);
    -> end if;
    -> end$
Query OK, 0 rows affected (0.16 sec)

mysql> update Highschooler set grade = grade +1 where ID=1501$
Query OK, 1 row affected (0.08 sec)
Rows matched: 1  Changed: 1  Warnings: 0

mysql> 
mysql> create trigger graduate after update on Highschooler for each row begin if new.grade>12 then delete from Highschooler where ID=new.ID; 
	  delete from Highschooler_1 where ID=new.ID; 
	  ELSEIF new.grade=old.grade + 1 then update Highschooler_1 set grade=grade + 1 where ID in (select ID2 from Friend where ID1=new.ID); 
	  update Highschooler_1 set grade=grade+1 where ID=new.ID; end if; delete from Highschooler_1 where
 	  grade = 13; end$
Query OK, 0 rows affected (0.13 sec)

mysql> 


